{
  "session_id": "sess-player-ct901",
  "project": "minebit",
  "subject_type": "player",
  "owner": "clawver",
  "storage_state_ref": "workspace/shared/test-results/CT-901/sessions/player-auth.json",
  "token_ref": "vault://sessions/sess-player-ct901",
  "created_at": "2026-03-13T10:00:00Z",
  "expires_at": "2026-03-13T11:00:00Z",
  "refresh_strategy": "ui_login",
  "status": "active"
}
